{"schemaVersion":1,"defaultLocale":"zh-CN","locales":["zh-CN","en-US"],"resources":{"characters":{"f0303244-602a-4ebc-bc70-97b463740999":{"key":"narrator","nameKey":"character.f0303244-602a-4ebc-bc70-97b463740999.name"}},"variables":{"08f312e2-9fc2-564d-9a76-f425682aaf83":{"key":"accepted","type":"boolean","defaultValue":false},"4fda17ea-8967-5347-9f92-1532de5fb3f5":{"key":"title","type":"string","defaultValue":"hero"},"8e461bd2-aa25-5893-a1ac-e2dba3caba70":{"key":"score","type":"number","defaultValue":0}},"events":{"035c644a-d873-5667-b0da-0e9897305c7e":{"key":"quest.begin","params":[{"key":"quest","type":"string","required":true,"defaultValue":null,"description":""}]}}},"dialogues":{"2fd88ddc-aa3b-466f-92a2-48785adce71e":{"key":"sdk_demo","entryNodeId":"d7f3c569-bde2-5523-9ea2-d810af740607","nodes":{"1c6b84a2-3e82-5880-a952-af54abbfe019":{"key":"condition","type":"condition","condition":{"all":[{"variable":"accepted","operator":"==","value":true},{"any":[{"variable":"score","operator":">=","value":2},{"not":{"variable":"title","operator":"==","value":"hero"}}]}]},"branches":{"true":"e4489f77-86aa-51ce-9722-74e853e9e16a","false":"60a9157f-4472-5a85-af29-53af179a7246"}},"2896611f-3dce-5787-afc3-7197dccbfdc3":{"key":"choice","type":"choice","choices":[{"id":"accept","textKey":"dialogue.2fd88ddc-aa3b-466f-92a2-48785adce71e.2896611f-3dce-5787-afc3-7197dccbfdc3.choice.accept.text","next":"61622527-bf58-5f86-9808-520e8ac3c809"},{"id":"reject","textKey":"dialogue.2fd88ddc-aa3b-466f-92a2-48785adce71e.2896611f-3dce-5787-afc3-7197dccbfdc3.choice.reject.text","next":"60a9157f-4472-5a85-af29-53af179a7246"}]},"60a9157f-4472-5a85-af29-53af179a7246":{"key":"reject","type":"dialogue","textKey":"dialogue.2fd88ddc-aa3b-466f-92a2-48785adce71e.60a9157f-4472-5a85-af29-53af179a7246.text","next":"c2eb420e-41be-50b0-a1d9-ed45c4991dd8"},"61622527-bf58-5f86-9808-520e8ac3c809":{"key":"set","type":"event","event":"variable.set","params":{"key":"accepted","value":true},"next":"a3dbf534-6b4c-5104-84e1-8e1056a8a760"},"9d530461-16cf-50ef-8708-ed40d02b402a":{"key":"welcome","type":"dialogue","speakerId":"narrator","hostEvents":[{"name":"ui.show","payload":{}}],"textKey":"dialogue.2fd88ddc-aa3b-466f-92a2-48785adce71e.9d530461-16cf-50ef-8708-ed40d02b402a.text","next":"2896611f-3dce-5787-afc3-7197dccbfdc3"},"a3dbf534-6b4c-5104-84e1-8e1056a8a760":{"key":"add","type":"event","event":"variable.add","params":{"key":"score","value":2},"next":"1c6b84a2-3e82-5880-a952-af54abbfe019"},"c2eb420e-41be-50b0-a1d9-ed45c4991dd8":{"key":"end","type":"end","hostEvents":[{"name":"ui.hide","payload":{}}]},"d7f3c569-bde2-5523-9ea2-d810af740607":{"key":"start","type":"start","hostEvents":[{"name":"camera.prepare","payload":{"nested":[1,true,null]}},{"name":"analytics.enter","payload":{}}],"next":"9d530461-16cf-50ef-8708-ed40d02b402a"},"dfe2b635-b54f-55a9-b018-ddb831f0ad8b":{"key":"auto","type":"dialogue","advancePolicy":{"mode":"auto","delayMs":500},"textKey":"dialogue.2fd88ddc-aa3b-466f-92a2-48785adce71e.dfe2b635-b54f-55a9-b018-ddb831f0ad8b.text","next":"c2eb420e-41be-50b0-a1d9-ed45c4991dd8"},"e4489f77-86aa-51ce-9722-74e853e9e16a":{"key":"business","type":"event","hostEvents":[{"name":"fx.quest","payload":{}}],"event":"quest.begin","params":{"quest":"first"},"next":"dfe2b635-b54f-55a9-b018-ddb831f0ad8b"}}},"32d95459-a856-5c3c-8583-58f794fb3a4f":{"key":"root_demo","entryNodeId":"3f0e9d88-5ec4-4cf5-9a83-9ad4ee9f7451","nodes":{"3f0e9d88-5ec4-4cf5-9a83-9ad4ee9f7451":{"key":"start","type":"start","next":"7aa254b1-2b75-4445-8f09-87b9af718dd7"},"7aa254b1-2b75-4445-8f09-87b9af718dd7":{"key":"welcome","type":"dialogue","speakerId":"narrator","textKey":"dialogue.32d95459-a856-5c3c-8583-58f794fb3a4f.7aa254b1-2b75-4445-8f09-87b9af718dd7.text","next":"b4aa0f79-bd0e-45cd-8a6e-094e6f50ccfd"},"b4aa0f79-bd0e-45cd-8a6e-094e6f50ccfd":{"key":"end","type":"end"}}}}}
